2669, আমি বিদ্রোহী  ভগবান বুকে এঁকে দিই পদ চিহ্ন ,
2672, আমি খেয়ালী বিধির বক্ষ করিব ভিন্ন ,
2673, বিশ্ব ছাড়ায়ে উঠিয়াছি একা চির উন্নত শির ,
2676, মাহমুদুর রহমানের সাক্ষাতকার প্রচারের জন্য বিবিসি বাংলার প্রতি অনুরোধ রইল। ,
2677, যদি কেউ জানতে চায় যে কোন মানুষ বা কোন দল সঠিক পথে আছে? ,
2678,তবে তার উত্তর হবে যে মানুষ বা যে দল সবচেয়ে বেশি নির্যাতিত হয় দুনিয়ার বুকে। ,
2679,তার পরে যদি জানতে চাওয়া হয় তাদের কি কোন শান্তি নেই? ,
2680,তার উত্তর হবে তাদের শান্তি একমাত্র আখিরাতে। ,
2689, কেন প্রতিবেশী হয়েও চুপচাপ আজ বাংলার সরকার? ,
2690,নাকি দাদার আদেশ হয়নি আজিও প্রতিবাদ করিবার? ,
2691, আজ দাদার ভয়ে চুপচাপ হয়ে থাকতেই হয় যদি ,
2692,তবে কেন আজো আগলে রেখেছো স্বাধীন দেশের গদি? ,
2693, রবার্ট ফিক্স হামীদ মীর কুলদীপ নায়ার এবং বাংলা দে শের মাহমুদুর রহমান যারা স ত্যের প থে নি র্ভিক ,
2694, আলহামদুলিল্লাহ্ জেলে থাকা জামায়াত শিবির সহ সকল বিরোধীদলের নেতাকর্মীদের মুক্তি চাই ,
2695, ভালো হয়ে চইলেন মিয়া ভাই কাবা শরীফের পবিত্রতা বজায় রাইখেন গিলাফ নিয়া মিথ্যা প্রচারনা চালাইলে কানে ধইরা আবার খোয়ারে ঢুকানো হবে ,
2697, এইসব শয়তান ইসলাম ও দেশের শত্রুরা জামিন পায় আর কত বিনা অপরাধীরা জেলে পচে মরে আল্লাহ অসহায়দের সহায় হোক। ,
2698, জিগ্যাস করেন আর বকর বকর কর বে কিনা।আর হেফাজ তের কাছ থে কে তিন কো টি টাকা যে খাই সে সে গু লো আছে না শেষ ক রে ফেল ছে। ,
2699, পাকিস্থানী গুপ্ত চর ও সজিব ওয়াজেদ জয় হত্যার সড়যন্ত্র কারি। মাহমুদুর রহমান এর জামিনের প্রতিবাদ জানাই। ,
2700, সাম্প্রদায়িক দাঙ্গার উস্কানি দাতা মামুদুর রহমান একজন নাস্তিক প্রমান মাথায় টুপী দেয়না মুখে দাড়ি রাখেনা নামাজও পডে না ,
2701, দেশে গণতন্ত্র প্রতিষ্ঠায় সাহসী ভুমিকা অব্যাহত রাখবেন আশা করি। সুস্বাস্থ্য কামনা করি। ,
2702, সঠিক বা ভুল পক্ষে বা বিপক্ষে গণমাধ্যমের কণ্ঠরোধ করে গণতন্ত্রকে বাঁচিয়ে রাখা যায়না। ,
2703, মহানায়কের জামিনে মুক্তিরর পাওয়ার খবর দেশের গনতন্ত্রকামী জনতাকে আশার আলো দেখিয়েছে প্রেরনা জুগিয়েছে ,
2705,আল্লাহ আপনাকে হেফাজত করুন সুস্থ রাখুন ভালো রাখুন। ,
2706, আমার প্রিয় মানুষ গুলোর মধ্য উনি অন্যতম ,
2707, অনুচ্ছেদ অনুযায়ী তার প্রতি এটা অন্যায় ও অবিচার করা হয়েছে কোথায় আমাদের মনুষ্যত্ব কোথায় আমাদের বিবেক???? ছিঃছিঃ ,
2708, কেন তাঁ কে ব ন্ধি করা হ য়ে ছিল এমন কোন নিউজ ক রে নি কেন বি বি সি?? নিশ্চই ক্ষমতাসীনদের ভ য়ে। ,
2712, এই মওদূদীর দালালকে নিজামীর সাথে এক রশিতে ঝুলালে জাতি অনেক বিপদ থেকে বেঁচে যেত ,
2713, এখানে কমেন্টসগুলো পড়ে দেখছি হিন্দু ধর্মীরা মাহমুদুর রহমানের বিরুদ্ধে । আমাকে আবার গালি দিয়েন না নিজেরাও দেখতে পারেন । ,
2714, আবার একটা ঝামেলা সৃষ্টি করবে এই লোক । কে জানে কার ছবি কোথায় জুড়ে দিয়ে অপপ্রচার চালবে । ,
2716, এইটা কি সেই খবিশ না যে নাকি কাবার গিলাপ পরিবর্তনের দৃশ্য কে সাইদী মুক্তির আন্দোলন বলে চালিয়েছিল। ,
2717, একজন সৎ সাহসী বিপ্লবী সাংবাদিক আজ জালিমের কারাগার থেকে মুক্তি পেল। ,
2718,তিনি যে বীরত্তের পরিচয় দিয়েছেন অন্যায়ের কাছে মাথা নত না করার ইতিহাসে স্মরনিয় হয়ে থাকবেন। ,
2720, আবার শুরু হবে মিথ্যাচার কখনো কাবা শরীফ নিয়ে কখনো চাঁদে সাইদি কে দেখা নিয়ে। ওর মত হারামি জেলে থাকলেই দেশের মানুষের জন্য মঙ্গল। ,
2721, যে ভাবে চামচাগিরী হচ্ছে ভুলে না আবার বলে ফেলে যে মাহামুদুর রহমান বাংলাদেশের স্বাধীনতার ঘোষক ,
2723, মিথ্যাবাদী সাংবাদীক মিথ্যা খবর ভুল ইতিহাস প্রচার করা যার পেশা তার তো জেলেই থাকা ভালছিল। ,
2725, সম্পাদকীয়তার নাম করে যদি শয়তানি করা হয় তাহলে তো সাজা ভোগ করতেই হবে হ্যাঁ। ,
2727, আশা করি উনি এখন থেকে ভালোভাবে চলবেন মাথায় উলট পালট উদ্ভট চালবাজি বাদ দিবেন। ,
2728,ষড়যন্ত্র করে জেল খাটবেন এইটুকু লাণ। ,
2730, তাতে খুশি হওয়ার কিছু নাই দুই দিন পর আবার ডুকাইবো। ,
2731, এই কুলাঙ্গারকে জামিন দেওয়া উচিৎ হয়নি।এদেশের নুন খেয়ে অন্যের গুন গায় এই নেমক হারামী।আবার ঢোকানো হোক জেলে। ,
2733, লড়ে যায় বীর ভয়ে মরে কাপুরুষ ,
2734,হে বীর তোমাকে হাজারো সালাম । ,
2735, স্বৈরাচারী শাসক হিংস্র বাঘের চেয়েও ভয়ংকর। ,
2736, অনেক ভালবাসা আর শুভকামনা রইলো। ,
2737, উনাকে জেল খাটিয়ে সরকার কি পেল? ,
2738, আর কোনো চাপ থাকুক আর না থাকুক পরিবারের চাপে এখন হয়তো চুপ থাকবেন ,
2741, আমার পছন্দের মানুষদের মধ্যে অন্যতম মজলুম সম্পাদক মাহমুদুর রহমান সাহেব ,
2742, অকুতোভয় কলম সৈনিক সামনে এগিয়ে চলুন আল্লাহ আপনার সহায় আছেন ,
2743, আমরা হাসব না কেবল এর জবাব যখন দেব তখন হাসব।।।। ,
2744, মজলুমের চোখের পানি কখনো বিরোতা যায় না ,
2745, এই হারামির জন্ন্য ব্লগার রা খুন হয়চে।।উস্কানি দাতা ,
2746, নিন পর আজকে মুক্তি পেলেন মাহমুদুর রহমান। প্রতিটি দিনের হিসাব নেওয়া হবে ইনশাল্লাহ। ,
2747, শুধু ক্ষমতায় টি কে থাকার জন্যই এত অত্যাচার। ,
2748, সত্যকে দমিয়ে রাখা যায় না এটাই প্রমান হয়ে আসছে যুগ যুগ ধরে। ,
2749, অতি জনপ্রিয়তা আবারও গ্রেফতারের কারণ হতে পারে । ,
2750, স্লো পয়জনিং করা হয়েছে কিনা জানিনা তবে সু চিকিতসার দরকার ,
2751, আমার প্রিয় মানুষ মাহমুদুর রহমান। ,
2752, প্রত্যেকটা সাংবাদিক যদি মাহমুদুর রহমানের মত সাহসী হত ,
2753,আমার দেশ স্বাধীন কর । ,
2754, অন্যায়ের কাছে মাথা নত করে নাই এই বীর কলম যুদ্ধা। ,
2755, মাহমুদুর রহমান একটি জাতির বিবেক ,
2757, কি কারনে এত দিন কারাগারে ছিল সেটা বিশ্বের সামনে তুলে ধরেন না কেন ,
2758, অভিযোগ রাষ্ট্র দ্রোহের বছরে কিছুই পাওয়া গেল না? ,
2759, মাহমুদুর রহমান বাংলার শ্রেষ্ঠ সন্তানদের কাতারে। ,
2760, কি দরকার ছিল। ভিতরে ছিলেন ভালই ছিলেন। বাইরে সারকাস চলে। ,
2761, ওরা জাতির মুখের ভাষা কাইড়া নিতে চাই বর্তমান সরকার ,
2762, কারাগার থাকবে শুধু বন্দী পরিবর্তন হবে। ,
2763, এই লোক খুনি।।।উস্কানিদাতা।।।ব্লগার দের খুনের পিসনে এ দায়ি ,
2765, হাজার সালাম শুভ কামনা রইলো মাহমুদুর রহমানের জন্য ,
2766, শুনে খুশি হলাম আর শুকরিয়া আল্লাহ পাকের কাছে আলহামদুলিল্লাহ ,
2768, আলহামদুলিল্লাহ মজলুম সম্পাদক মাহমুদুর রহমান মুক্তি পেয়েছেন ,
2769, সরকারের খমতা জতো সেস হবে বিরদিরা ততোই খমতাবান হবে এটা সাবাবিক ,
2770, সফলতার ইতিহাস লেখা হয় সংগ্রামে। ষড়যন্ত্রে নয়। ,
2771,ভয় নায় হে বীর সেনানী ,
2772, এইটা তো ভিতরেই ভাল আছিলো। ,
2773, হে সাহসী সৈনিক আপনাকে জানাই হাজারো স্যালুট আল্লাহ আপনার সহায় হোন ,
2775, কই মুকতি চতুর দিকেই পুলিশ ,
2776, বদমাইসটা ছাড়া পাইলো ক্যামনে?এবারতো হ্যায় প্রত্যেক বিশ্ববিদ্যালয়ে সত্যি সত্যিই লাশের লাইন লাগাই দিব। ,
2777, বল বীর আমি উন্নত মম শীর ,
2778,বন্ধুর পথে চলতে চলতে কাজের সূত্রে দেখা ,
2779,সে দেখার পর তোমার আমার মিলেছে সরল রেখা ,
2780,সংগ্রামী তুমি সাহসী যোদ্ধা শেখনি হটতে পিছু ,
2781,গালি অপমান জেল রিমান্ডে মাথা করনিকো নীচু। ,
2782,সবাই যখন ভয়ে কাচু মাচু সত্য লিখেনি হায় ,
2783,নির্ভীক তুমি লিখে গেছো সব কাঁধে নিয়ে তার দায়। ,
2784,আমারদেশ কে বানিয়েছো তুমি ন্যায়ের কন্ঠস্বর ,
2785,তাই কেঁপে ওঠে দূর্নীতি আর জুলুমবাজের ঘর। ,
2786,বিচারের নামে কেলেঙ্কারির মুখোশ দিয়েছো খুলে ,
2787,সেই কলংক বিশ্ব বিবেক যাবেনা কখনো ভুলে। ,
2788,অর্থের লোভ ক্ষমতার মোহ হুমকি ,
2789, একই পথে আবার ফিরে যাবেন না তো? ,
2790, বি বি সি বাংলার প্রতি অনুরোধ মাহমুদরর রাহমানের সাক্ষাতকার বাংলার কোটি জনতাকে শুনানোর ,
2791, আল্লাহ না করুক এবার গুম করে পেলে নাকি মনে ভয় হয় ,
2792, ভাল। এভাবে কতদিন চলতে পারে ? ,
2793, হাজারো দালালের মাঝে আজো আমি বাংলাদেশ দেখি৷ ,
2794, বিবিসিতে মাহমুদুর রহমানের একটি সাক্ষাত্কার প্রকাশের অনুরোধ করছি। ,
2795, তুমায় হাজার সালাম কলম যোদ্দা মাহমুদুর রহমান তুমি কোটি মানুশের প্রান। ,
2796, এক দিন আ লীগকে এমন করতে হবে যা সব সময় মনে রাখে এরা ভোট চোর । ,
2797, ওরে তো আবার ডুকালো বলে। ,
2798, হে বীর পুরুষ তোমাকে স্বাগতম। ,
2799, আল্লাহ্ তাকে সুছতো করে দিন ,
2800, বাংলাদেশের বিচার বিভাগ স্বাধীন ও নিরপেক্ষ তা আবার প্রমান হল ,
2801, আবার একমিনিট পরে গ্রেপতার হবে না তো ,
2802, এর থেকে কথা বার্তা বুঝে শুন বলবেন ,
2803, দুএক দিনের মধ্যেই আবার গ্রেফতার হবে ,
2804, আবেগে চোখের পানি ধরে রাখতে পারেনি স্যারকে অভিন্দন ,
2805, মাহমুদুর রহমান কোটি মানুষের নেতা ।দূবাই থেকে । ,
2806, উনি জেল গেটে থাকলেই পারত না হলে তো কষ্ট করে আবার আসতে হবে ,
2808, ব্রাটিশ তারা নজরুলের পড়ে মাহামুদূর রহমান ,
2809, মাত্র পাচটাকা দামের কলমের এতশক্তি যদি থাকে মাহামুদুুর রহমানের হাতে। ,
2810, কতদিন জামিনে থাকে তা দেখার বিষয় ,
2812, এডিটর মাহমুদুর রহমান কে বাইচান্স আবার গ্রেপ্তার করলে কি হবে ? ,
2813, কয় দিন পর অাবার ধরবে তার চেয়ে জেলেই ভালো ছিলো ,
2814, আলহামদুলিল্লাহ অভিনন্দন জানাই বীর কলম সৈনিক কে ,
2815, ভয়ে কাপেঁ ভীরু লড়ে যায় বীর। ,
2816, লিডার সাবধান থেকো। সাগর রুনির কথা মনে করতে চাইনা ,
2817, এই তিন বসরের কি হবে? ,
2818, মানুষকে কষঠ দিয়ে লাভ কি ,
2819, বেশী দেরি নাই আবার ডুকবে এই লেজ কাটা বানর টা ,
2820, বর্তমান সরকার বিরোধী দলের উপর অনেক নির্যাতন করছে। ,
2821, এর খেসারত হাছিনাকে একদিন দিতে হবে ,
2822, একেই বলে সত্যের মৃত্যু নেই ,
2823, বিবিসি সংবাদ ধর্মপাশা সুনামগঞ্জ কি শুনা যায়? কখন? ,
2824, অবশেষে কলম যোদ্ধা মাহমুদুর রহমান জেল থেকে মুক্তি পেল ,
2825, শক্তিমান এই কিংবদন্তি লেখকের কারামুক্তিতে রইল স্বশ্রদ্ধ অভিনন্দন ,
2826, সাইদি সাব কে এভাবে দেখতে চাই ,
2827, আর ভেজাল লাগাবেন্না। নইলে আবার সোজা গারোদে। ,
2828, কলেমের সৈনিক সেলুট তুমায় আর আপনার শারিরিক সুস্থতা কামনা করি। ,
2829, মাহমুদুর রহমান যাকে গণতন্ত্রের প্রতিক বলা হয় ,
2833, জেল গেইট থেকে আবার গ্রেফতার করা হয়নি তাহলে? বদনা ভাংচুর মামলা দিয়ে তো তাকে গ্রেফতার করা যেতো ,
2834, জেলগেইট থেকে আবার গেরেফতার হবে নাতো ,
2835, দলকানা আতঙ্কবাজ দেশদ্রোহী জ্ঞানপাপী।তারমত কূলাঙ্গারের জেলের ভিত্রে থাকাই দেশ জাতী এবং শোভ্যতার জন্য মঙ্গল ,
2836, একজন নির্বিক সাহসী কলম সৈনিক মাহমুদুর রহমান। ,
2839, আসুন আমরা সবাই মিলে বাংলাদেশ কে বৌদ্দ মুক্ত করি ,
2840, স্বৈরচারী সরকারের বিরুদ্ধে লিখতে গিেয় যে অত্যাচার সহ্য করল ,
2841, তিনিই হচ্ছেন আপোষহীন সাংবাদিকতার আপোষহীন বীর সাংবাদিকতা বলতে আমি এটাই বুঝি। ,
2842, জালিমের নগ্ন থাবা যদি এবার বন্ধ হয় ,
2844, আওয়ামী পা চাটা সাংবাদিক নামের দেশদ্রোহীদের এর চেয়ে ভয়ানক পরিণতি হতে পারে এক মাঘে শীত যায়না ,
2848, বি বি সি বাংলাকে ধন্যবাদ বস্তু নিষ্ঠ সংবাদ পরিবেশন ও শ্রোতাদের প্রশ্নের জবাব দেওয়ার জন্য। ,
2849,বাংলাদেশের সরকারী সেক্টর গুলোর দূর্নীতি নিয়ে কোন প্রতিবেদন করেন না কেন। ,
2850, ইনি মুক্তি পাইলে তো আবার শুরু করবো পুংটাপুংটি। ,
2851,বাশেঁরকেল্লায় তো মিষ্টি বিতরন শুরু হইবো ,
2852, স্বাগতম । মেধাবী জ্ঞানী ও সাহসী মাহমুদুর রহমানের মুক্তি হল। দেশের জন্য যাকে খুব প্রয়োজন। ,
2854, বেচারি মনে অনেক দুঃখ আছে সুইদির জন্য অনেক মিথ্যা সংবাদ প্রচার করলে ও নেজামি মুজাহিদ সাকার জন্য কিছু করতে পারেনি ,
2855, মহান আল্লাহ তায়লার কাছে লাখো কোটি শুকরিয়া যে মাহমুদ ভাইকে সুস্থভাবে আমাদের মাঝে ফিরিয়ে দিয়েছেন। ,
2856, মাহমুদুর রহমানের মূল্যবান কথা বিবিসি মাধ্যমে শুনতেছাই ,
2857, আওয়ামীলীগের দুশাসনেব জুলুম ও নিযাতনের একমাএ প্রতীক এর নাম মাহমুদুর রহমান । ,
2858, একটা ভুয়া গুজুব রটানো সাংঘাতিক এর মুক্তিলাভ ,
2860, কাল যে কোন মামলায় আবার নতুন করে গ্রেফতার করা হবে না তা কে জানে ,
2861, যে অপরাধে তাকে এতদিন কোর্টের বিচারকরা আটকাইয়া রাখলেন । তার স্বাভাবিক সাজার মেয়াদ কতদিন । ,
2862,বিনা বিচারে একজনকে জেলে আটকাইয়া রাখা অবশ্যই অপরাধ । ,
2863,কিন্তু বিচারকদের বিচার এই দেশে কে করবে ।আমরা তাদেরকে শুধু ঘৃণাই জানাতে পারি । ,
2864, বিবিসি আগের মত নিরপেক্ষ কাজ করে নি ভাই। ,
2866, ঢাকা পোশাক প্রশ্তত কারি শ্রমিক সংঘ লাইক ,
2867, পৃথীবিতে ভাল মানুষ কস্ট পেলেও বিজয়ী হয় ,
2868, জামিন পেতে জদি মাস সময় লাগে তাহোলে বিচার পেতে কত মাস ??????? ???????????? ,
2870, সময়ের সাহসী কলম যোদ্ধা যিনি জাতির সারথে কাজ করার দিঢ় প্রত্যয় ই ,
2871, ভালোবাসার অন্যতম একটা সুন্দর পেজ ফিরে আসবে কথা দাও । ভালোবাসার গল্প ও বানী পেতে এই পেজে লাইক দিন ফিরে আসবে কথা দাও ,
2872, প্রথম বাংলাদেশ আমার শেষ বাংলাদেশ জীবন বাংলাদেশ আমার মরন বাংলাদেশ ,
2877, পাটের পাতার চা এটা হলে তো ভালোই হয় তবে কচুরি পানার চা হলে ভালো হতো দেশের নোংড়া পরিষ্কার হতো ,
