3810, অবাধ সুষ্ঠু ও নিরপেক্ষ নির্বাচন হলে বিএনপি সমর্থিত মেয়র প্রার্থী বিপুল ভোটে জয়লাভ করবে ইনশা আল্লাহ। ,
3812,সমগ্র দেশে ধানের শীষের জোয়ার উঠবে। ,
3813,বিদ্র ফেনীর মেয়ে খালেদা গর্ব মোদের আলাদা ,
3814, আমাদের নেত্রীর অনেক বয়স হয়েছে তাই নেত্রী নামার আগে আমরাই নেমে পড়ি কি বলেন বি এন পির ভাইয়েরা?আমরা কেন নেত্রীর দিকে তাকিয়ে আছি? ,
3815, আর কোন হিসাবেই কাজে আসবেনা কারণ বাংলাদেশের মানুষ এখন খুবই সচেতন তোমাদের ধর্মের ব্যাবসা বন্ধ হয়ে গেছে ,
3818, আর কবে নামবেন। মাঠে নামবেন নামবেন করে তো বয়সই পার করে দিলেন।আপনার দ্বারা এটা আর সম্ভব হবেনা আর বিএনপিও আস্তে আস্তে অন্ধকারে তলিয়ে যাচ্ছে সেটাই দেখতে পাচ্ছি। ,
3819, খালেদা জিয়ার পিছনে নয়াদিগন্তের সাংবাদিক ছাড়া হয়ত আর কাউকে পাওয়া যাবে না। ,
3820, ম্যাডাম কথা কম কাজ বেশী এমন হ তে হ বে। অার শিমুল বিশ্বা সের মত লো কেরা দ লের ক্ষ তি করতা ছে সে দি কেও দেখ তে হ বে ,
3821, বাংলার মানুষ গণতন্তের জন্য প্রাণ দিতে প্রস্তুত আছে শুধু নেতিত্ব চায় মাঠে আসেন এই সরকারকে পালানোর রাস্তা দেওয়া হবেনা ,
3822, নিরপেক্ষ নিরবাচন এর জন্য আন্দলন করলে সারা দেশের জনোগন পাসে পাবে কারণ সরকার জোরকরে জনোগনের ভোটার অধীকার কেড়ে নিয়েছে এর কঠিন মূল্য সরকারকেই দিতে হবে। ,
3823, এক কথা শুনতে শুনতে কান ঝালাপালা হইয়া গেলো। আমার বাচ্চাকাচ্চা নাতিনাতনি রাও মনে হয়য় এই এক কথাই শুনবো। ,
3824, জনগন যদি নির্বিঘ্নে ভোট দিতে পারে তাহলে বিএনপি রের্কড ভোটে জিতবে তাতে কোন সন্দেহ নেই। কিন্তু তার পরও নির্বচন কমিশনলীগ আ লীগকে বিজয়ি ঘোষনা করবে। ,
3825, তারেক দেশে আসুক সব হিসাব এমনিতেই পাল্টে যাবে এইসব মা বৌ দিয়ে কোন হিসাব পালটাবে না আর হ্যাঁ মোদী সাহেবের সাথে হাত মেলালেও হিসাব পালটাবে আরও সহজে ,
3826, বি এন পি র মাঠে নামার সাহস নাই।কারণ বি এন পি নেতারা লাঠি দেখলে ভয় পায়।এরা শুধু ঘর থেকে বড় বড় কথা বলে। ,
3827, এক কথা এক দাবি খালেদা তুই কই পালাবি সামনে আছে শুভু দিন নৌকায় ভোট দিন আইভি আপার ছালাম নিন নৌকায় ভোট দিন ,
3829, অফ সাইড সেম সাইড আর পেলন্টি মিসের মাধ্যমেই খেলা শেষ করবেন ফলাফল যা ছিলো তাই থাকবো । ,
3830, নেএী তুমি এগিয়ে চলো কোটি লোক তোমার সাথে। নেএী তোমার ভয় নাই রাজপথ ছাড়ি নাই ,
3832, দেশে বাকশাল কায়েম এতো কষ্টে হয়েছে আর উনি সেটা বুঝতেই পারেন না আর এমনি যদি নিরপেক্ষ নির্বাচন হয় লীগ বিপুল ভোটে জয়ী হবে ,
3836, যদি নামার রাস্তায় বালুর ট্রাক এসে দারায়। তবেকি ট্রাক দাক্কা দিয়ে সরানোর শক্তি বেগম জিয়ার আছে। ,
3837, নিজের পতিকটাও ধরেছে বাম হাতে খালেদা তোমাদের বাংলার মানুষ চাইনা এটা বুঝতে পারেন না? ,
3839, সেই তো কয়েক বছর থেকে বলতেছে মাঠে নামবো ,
3840, কোন লাভ হবেনা ঈদের ও শেষ হবেনা ,
3841, মাঠে নামলে হবে না গোল করতে হবে মাঠ গরম করে জয় ছিনিয়ে আনতে হবে ,
3842,যে দল ই ক্ষমতাই আছে নিজেকে নিজের দল নিয়ে বিজি। খাবে মারবে নিজের দিক গুলা মনে করে।দেশের মানুষ এর কথা কেও ভাবেনা। দেশের মানুষ কি অবস্তা আছে। ,
3843, মেয়ে মানুষ এর বুদ্ধি হাটুর তোলে ,
3844,এদেশের জনগণ কে বাচতে হলে।এক জন পুরুষ যোগ্য সং মানুষ দরকার। ,
3845, আপনি যা করতে পারেন নাই আওয়ামীলিগ কিভাবে তা করিয়ে দেখিয়েছে এবং এখনো ক্ষমতায় আছে বাকী দিনেও থাকার সম্ভাবনা দেখতেছি। ,
3847, আমরা পাশে আছি খালেদা জিয়ার ,
3849, ম শ্রেনী পাশ নেত্রি আর কি হিসাব জানবে ? ,
3850, খালেদার নাটক সুরো বিএনপি রাজাকারের দল ,
3851, কথা কম মাঠে নামলেই জনগন দেখিতে পাবে। ,
3852, তার নেক হায়াত কামনা করিতেছি। ,
3853, মাঠে মানুষ ধান কাটতেই নামে । ,
3854, পুলিশ বিজিবি ছাড়া মাঠে নামেন আওয়ামী লীগের সমর্থক দের খুজে পাওয়া যাবে না বি এন পির বিরুদ্ধে এদের অত্যাচার বন্ধ করুন দেখবেন বি এন পি মাঠে আসে কি না ,
3855, মাঠে নামলে কাপড় ভিজবে লেপ মুড়িদিয়ে সুয়েথাকেন তাতেই দল এগিয়েযাবে ,
3856, এখন হেগিন কই আর লাভ নাই সবাই যানে বি এন পি মানি বিনোদন ,
3857, বাল ছিড়তে মাঠে নামবে বিএনপি ,
3858, আর হবে না । অনেক দেরি করে ফেলেছেন ,
3859, ঈদতো অনেক দেরি।আপনারা তো আবার ঈদের পর ছাড়া পারেন না ,
3860, ছক্কা মারতে না গোল করতে ,
3861, আগিয়ে যান আমরা আছি আপনার সাথে ,
3863, কাজ হবেনা নৌকার জয় হবে ,
3864, মাঠে প্লিয়ার খেলা করছে কিন্তু গোল দিতে পারছে না। আমি মনে করি দোশটা কোচারের। ,
3866, বেগম খালেদা জিয়া ধান লাগাতে মাঠে নামতে পারে ,
3867, মাঠে নামার আগে আরো বেশি পর্যালোচনা প্রয়োজন ,
3868, পারবে না মনে হয়। কখন মরে যায় বলা যায়না। বয়স হয়ছে ত অনেক। ,
3869, নামলে তাড়াতাড়ি নামেন সময় খুব কম। ,
3870, হিসেব তো সবসময় পাল্টে দেয়। ,
3871,কিন্তু পরে নিজেরা পাল্টে যায়। ,
3872,কাজের কাজ কিছুই হয় না ,
3873, সম্ভব নাই বা হোক মাঝে মাঝে এসব কথা শুনলে মনটা চাংগা থাকে। ,
3874, উল্টাইয়া পাল্টাইয়া সব তামা তামা কইরা দেন ম্যাডাম ,
3875, খালেদার কথা শোনে হাসতে মন চায় ,
3876, একে বারে ঠিক কাজ হবে ,
3877, জানিত ম্যাডাম মাঠে নামবেন তবে এখন মাঠে অনেক পানি আগে পানি শুখাইজাক তারপর দেখবেন কতো গুল হয়। ,
3878, আল্লা মনের আসা পুরন করুণ । ,
3879, কিছুই হবে না যতক্ষন বিএনপি থেকে আগাছা দূর না হবে ,
3880, বাংলার জনগন এখন অনেক সুখে আছে ,
3881, ম্যম মাঠে নামার দরকার নাই। এমনিতেই মাঠ এখন পরিষ্কার। ,
3882, হয় । তিনি কি এই হিসাব ও পালটিয়ে দেবেন ? ,
3883, বালুর ট্রাক যেন কি জিনিস ছিল ? ,
3884, ধানের শীষ বাদ দিয়া রোহিংগাদের জন্য কিছু করেন । ,
3885, বাল ফালাইয়া টাল দিয়ে দিবে ,
3886, স্বপ্ন হতে পারে বাস্তবে অন্য কিছু হয়ে যাবে। ,
3887, সামসুর রহমান না ক্রিস গেইল খালেদা জিয়া? ,
3888, আপনি গনতন্রের নেত্রী কিন্তু এখনও আপনি নিরব। জাতি এই প্রশ্নে উত্তর খোজে কিন্তু পাই না। ,
3889, মেডাম এই দেশে ইসি কুত্তা আপনি ভোট চাইয়া লাব নাই কারন পাস করলেও দিবে না ,
3890, দাড়াবেন কথায় জায়গা নেই তো খালা আম্মা ,
3891, সাথে আছি ত্রকবিন্দু রক্ত থাকতে পিছু ছারবো না৷ ,
3892, আর কোন হিসাবই বাজে র ,
3893, সব হিসাব পাল্টাতে বহুত দেরি আছে। ,
3894, কোথায় ঘরে মেকাপ লাগাবে খুব ভাল ,
3895, সব হিসাব বাদ আপনার ছেলের হিসাব করেন। ,
3896, সতি কি মাঠে নামতে পারবে বিএনপি ,
3897, নেত্রী তুমি এগিয়ে চল আমরা আছি তোমার দল ,
3898, সব হিসাব পাল্টিয়ে আওয়ামী লীগকে ক্ষমতায় বসাবে বি এম পি। ,
3899, আমরা পাশে আছি আপনার বেগম জিয়া ,
3900, বাংলারজনগণ বিএনপি ছাড়া আর কিছু চাইনা ,
3901, কিসের হিসাব ধানের হিসাব নাকি ,
3902, যার ছবি দেখলেই জনগন থুতু দেয় সেখানে কেন যে মানুষ থাক আর বললামনা ,
3903, ইতা মিথ্যা সান্তনা মানুষকে দিয়ে কুনো লাভ নাই ,
3904,গি খায় না বাকিটা বুঝে নিশ ,
3905, হঠাও দূূরনিতি বাচাও দেশ খালেদা জিয়ার নির্দেশ ,
3906, ওকে আমরা আছি তোমাদের সাতে ,
3907, ধান লাগাতে খেতে নামিয়ে দেও। ,
3908, আমরা সব সময় বিএনপির পাসে আছি বাংলাদেশ ছাএ শিবির দিনাজ পুর জেলা শাখা ,
3909, কেমন সুষ্ট চান??? তারিখের মতো??????? ,
3910, নামেন কাপর কিন্তুু শক্ত করে বেদে নামবেন??????? ,
3911, কোন ঈদের পরে সেইটা তো বলেন নাই ,
3912, এ জনমে হবে না মনে হচ্ছে আর। ,
3913, এতদিন তাহলে গণিত প্রাইভেট পড়লো নাকি ? ,
3915, ফেনীর মেয়ে খালেদা এখন জনগন থেকে পুরাপুরি আলাদা ,
3916, তারাতারি নেমে পরুন বাংলার কোটি জনগন আপনার সাথে আছে। ,
3917, আমরা প্রবাসীরা দেশে শান্তি দেখতে চাই ,
3918, কোন লাভ হবে না । ,
3919, আমরাও আছি আপনার সাথে একমত ,
3920, আল্লাহ আপনার সাথে থাকবে ইনসআললাহ ,
3921, এপর্যন্ত খালি হেতি হিসাবই পাল্টাইল মাগার আজপর্যন্ত কোন হিসাব মিলাইতে পারলো না ,
3922, ভাইজানেরা অস্থির হয়েন না সময় আসবে ইনশাআল্লা ,
3923, আমিও চাই খালেদাজিয়া নেতু আসুক ,
3924, ট্রাম্পের নীতি অনুসরণ করবে মনে হয়। ,
3925, এখন আছে সুদিন নৌকা মাকা্ হাতে নিন ,
3926, সময় আছে নোকা হাতে নিন ,
3928, তোমায় লাখো সালাম বেগম খালেদা জিয়া ,
3929, আপনার সাতে সারা বাংলাদেশ আছে ,
3930, কোন ঈদের পর নামবেন ম্যাডাম ,
3931, ঈদের পর নামানো হবে কোন ঈদ পরে জানানো হবে ,
3932, আমরা আপনার জন্ন অপেক্ষা করছি ,
3933, আপনার সাতে আছি আমি খালেদা জিয়া ,
3934, কোন লাভ নাই রে গেদি ,
3935, কত হিসাব হল কোনো কাজ হবে না ,
3936, ধান ভালো হয়নি ঝরে পরে যাবে ,
3937, মাঠে নামার দরকার ছিলো আরো আগেই।মাঠে নামুন রক্ত জরুক তবুও লরাই করব। ,
3938, আমরা আপনার সাথে এগিয়ে যান ,
3939, বাংলাদেশের মানুষ আর চাই না হাসিনা কে ,
3940, ভারত কিন্তু অলরাউন্ডার জিতেই ছারবে সাবধান।।। বিঃদ্র যে খেলাই হোক না কেন। ,
3946, কি নিয়ে নামবে ফুটবল নিয়ে না কি ট্যানিস বল নিয়ে??? হেলমেট পইরা নামতে কইস ভাই। মাথায় বল পরলে আবাল চুলের ইস্ট্যাইল চেঞ্জ হইয়া যাবে ,
3948, অবশ্যই মানব অধিকার সব নেতৃত্বের প্রথম সাফল্য মানুষের ও সৃষ্টির কল্যাণে হোক রাজনীতি ,
3949, এই শীতে ? না না গরম আসলে। ,
3950,এই গরমে ? না ভাই সূর্যের যেই তাপ। হিট স্ট্রোক হবে। বর্ষায়। ,
3951,এই বর্ষায় ? না না বৃষ্টিতে কেউ বাইর হতে চাইবে না । ,
3952, একদম ঠিক কথা বহুদিন হল বাংলার মানুষ শানতিতে আছে৷এবার জালাও পোরাও শুরু করে দিন এটাই তো ওনারা পারেন ? ৷ হা হা হা ৷ ,
3953, খালেদা জিয়ার পিছনে নয়াদিগন্তর সাংবাদিক ছাড়া হয়ত আর কাউকে পাওয়া যাবে না ,
3954, নাই। বাসায় পূর্ণ বিশ্রামে থাকুন।যে ক দিন বাচবেন নামাজ কালাম পড়ুন।নোংরা রাজনিতি থেকে অবসর নিন। ডা জোবাইদাকে মাঠে নামান। ,
3955, উনি আবার হিসাব জানে নািক। নাজানলে এমনেতো পালটে জাবে হিসাব। ,
3956, মুখে বল্লে হবে না কথা টা কাজে লাগাতে হবে ,
3959, সাগ্বতম বাংলাদেশ জাতীয়বাদি জিয়ার সৈনিক ,
3960, হিসাব আর আপনার করা লাগবেনা সে দিন আপনার আর আসবেনা। ,
3961, মাঠে নামবে কেন ধান কাটার সময় হয়েছে নাকি ,
3962, মাটে নেমে কি হবে দুই ধলেই তো খারাপ ,
3963, এ অংশগ্রহণ করতে মাঠে নামবেন বেগম খালেদা জিয়া। ,
3964, জিয়াতোমার ভয়নাই আমরাআছি লাখোভাই এক জিয়ার লোকান্তরে লখ্খজিয়া ঘড়েঘড়ে ,
3965, মাটে ঘাটে পথে নামে ন তবে পেট্রোল বুমা নিয়ে নাইমেন না ,
3966, মাঠে নামতে নামতে গোল হয়ে যাবে ৷ ,
3969, পিছনের কথা ভুলে গিয়ে সামনে এসে কিভাবে নিরবাচন করবেন সেই চিনতা করেন ,
3970, দিনের হিসাবটা ভালয় ভালয় আগে না দিলে তো হিসাব মিলবে না। ,
3971, কেন আবার মানুষ পোড়ানো হবে নাকি ,
3972, ম্যাডাম এমন চমক দেখাবেন যাতে আওয়ামিলীগ দেশ থেকে বিতারিত হয়।। আর কোটি জনগন এখন তা দেখতে চায় ।।। ,
3973, আমরা চাই ম্যাডাম আপনি মাঠে নামূন ,
3979, অস্ট্রেলিয়ায় আওয়ামি লিগ কইত্তে পাবি? ,
3980, কি কয়ামরে স্বপ্ন না বাস্তব ,
3981, মায়ানমারে আরো একটির সন্ধান মিলেছে। ,
3982, নয়া দিগন্তের সাংবাদিকরে কামরাইছে মনে হয়। ,
3983, নয়া দিগন্ত পাগল হ য়ে গে ছে। পাবনা যে তে হ বে। ,
3984, হিন্দুদের বীর্যর কিছু শয়তান বাংলাদেশে আছে।মুসলিম মরলে খুশি হয়।এদেরকে জুতা পিঠা করা উচিত। ,
3989, রেন্ডিয়াতে পারমানবিক বোমা মেরে দেয়া উচিৎ ,
3990, পশ্চিম কাংলার গরুর সন্তান ঐ ,
3996, হিন্দুরা নিজ হাতে বানানো মানে নিজ হাতে ফালতু ভগবান তৈরি করে নিজেই আবার পুজা করে। ,
3997, ঘোড়ার ডিম আওয়ামীলীগ কখনো মুসলিম হতে পারে না। ,
3998, একজন মুসলমান মারা গেলে অন্ন যে মুসলমান খুশি হয় সে তো বিজন্মার বাচ্ছা ,
4000, হিন্দুরা কখনো মুসলিমদের দেখতে পারেনা ঘৃনা করে ধর্মের কারনে।মুসলিমরাও তেমন হিন্দুদের দেখতে পারেনা। ,
4007,ধন্যবাদ আমার বিজ্ঞাপন টি দেখার জন্য ,
4008, সালারা পাকিস্তানি সৈনিকদের সাথে না পেরে বেসামরিক বাসে হামলা চালিয়ে বুঝিয়ে দিয়েছে তারা হিজড়ার দল। ,
4010, জনের পরিবর্তে জন ভারতিও মালাউনকে ঘন্টার ভিতর হত্যা করা হোউক। আর আমি জানি পাকিস্তান তোমরা সেটা পারবে এবং করবে। ,
4011, মালুরা তো কিছু পারে না পারে সাধারণ মানুষ হত্যা করতে যেটা তারা বাংলাদেশ সীমান্তে করে ,
4014, পাকিস্তান গোলাপ ফুল নিকখেপ করবে নাকি মালু ? অপেকখা কর ওরা কয়টা গো মুত্র খোর কে খালাস করে । ,
4015, ওরে আমার চাম উকুইন্যা ব্বাংলাদেশী তুই কি পাকিস্তানী ? ,
4021, মেহেদুল জে ধর্ম অন্য ধর্ম কে সন্মান কোরতে না পারে সেটা কিকোরে সান্তির ধর্ম হয় ? ,
4022, তোমাদের দাদারা আবার আমাদের ধর্ম কে সন্মান করেছে বুঝি ,
4024, আমি কোনো ধর্মের দালাল নয় তবে এটা জানি মুসলমান হিন্দু বৌদ্ধ হওয়ার আগে মানুষ হওয়া দরকার ,
4026, ভারত এটা ছাড়া কিছুই করতে পারবে না।হয়তো বা কাল শুনা যাবে ভারতের সেনা উদাও। ,
4027, টার বদলা হবে টা চিতা রেডি রাখতে বল ভারতকে ভারত তো কাপুরুষ ,
4028,সাধারণ মানুষকে গুলি করছে আর পাকিস্তান ভারতের সেনাদের সসানে পাটিয়েছে এবং পাটাবে ও কে। ,
4029, পাকিস্তান কিভাবে প্রতিশোধ নেয় দেখার অপেক্ষায় রইলাম।তবে ভারতকে কঠিন মাশুল দিতে হবে। ,
4031, হিজড়ারা পারলে পাক সৈন্যদের মার পারিস তো শুধু নিরীহ মানুষ মারতে যেমনটা বাংলাদেশ সিমান্তে করিস তোরা যে তৃতীয় লিঙ্গের একথা বিশ্ব জানে ,
