1420, আল্লাহ এসব বিপদ দিয়ে মেয়ের বাবাদের ধর্য ও মেয়ের প্রতি ভালবাসার পরিক্ষা নেই। ধর্য ধারন করুন আল্লাহ এর পুরষ্কার দেবেন। ,
1421, বিচারহীনতার জন্য যে দেশে একটার পর একটা মেয়ে ও তার পরিবার ধংশ হয়ে যায় মেয়ের বাবা হওয়া আসলেই পাপ সেদেশে ,
1422, আফসোস অত্যাচারী ছাত্রলীগ তাই শিরোনাম অন্যরকম। ,
1423,শিবির বা ছাত্রদল হলে শিবির সন্ত্রাসী বলে হেডিং হতো। ,
1424, যেমন সাপ তেমন লাঠি হতে হবে। ,
1425, কেন যে এসব করে বুঝি না। ,
1426, মেয়ের বাপ হওয়া অন্যায় নয় বরং কুলাঙ্গার ছেলের বাপ হওয়া লজ্জার অপমানকর। ,
1427, মানুষরুপী পশুরা যতদিন মানুষ না হবে ততদিন সমাজ জাতি দেশ নিরাপদ নয়। ,
1428, বাংলাদেশে গরীব ঘরে মেয়ে শিশু জন্মালে আগের দিনের মতো মেরে ফেলুন। ,
1429, দেশটা সবাই মিলেমিশে স্বাধীন করেছে লক্ষ্ লক্ষ্ মা বোনের সম্মান হানি হয়েছে কিন্তু হানাদার মুক্ত হলোনা ,
1432, হায়রে এ দেশে কোন কিছুর বিচার নেই কোনো পাপ এর শাস্তি নেই দিন দিন জঘন্য থেকে জঘন্য হয়ে যাচ্চে দেশটা ,
1434, জংগি মনোভাবের প্রকাশ । পত্রিকাটা আমাদের দেশের তাই নিজের দেশ নিয়েই কথা বলবে এটাই স্বাভাবিক। ,
1435, হিন্দুদের উপর যতো নির্যাতন হয় তার ঐ তাদের জ্ঞাতি ভাই ,
1436,আওয়ামীলীগ করে থাকে এখানে সংখ্যালঘু সংখ্যাগুরু বলতে ,
1438, বালের আলো মায়েনমার এর খবর চোখে পরে না???????? ,
1440, হেমায়েতপুর আসুন। একবার ঘুরে দেখে যান। ,
1442, দরজা খোলা দেখলে নক তো করবেই কিছু বকাটেরা।তবে ছেলেদের উচিত মেয়েদের করা।কারন কুরআনে ,
1443, মেয়েদের আগে ছেলেদের পদার্র কথা বলা হয়েছে। ,
1445, মিথ্যা বলা আমাদের মৌলিক অধিকার। ,
1446, শিশুদের কথা বাদ দেন দেশের প্রধানমন্ত্রী প্রথম আলো কম যায় নাকি???? ,
1447, কেন বঙ্গবাহাদুর উপাধী পায় ঐ ভারতের হাতি? ,
1448,কেন রোহিঙ্গা মুসলিম বাংলায় এসে খায় বিজিবির লাথি? ,
1449, কেন এক মালালায় উথলে ওঠে বিশ্ব মানবতা? কেন হাজার মুসলিম নির্যাতিত তবুও নিরবতা? ,
1450,কেন মানবতাবাদী সুশীল সমাজ মুখে কুলুপ এটে গা ঢাকা দিয়ে যাবে শুধু প্রভুদের কদম চেটে? ,
1451, কেন প্রতিবেশী হয়েও চুপচাপ আজ বাংলার সরকার? নাকি দাদার আদেশ হয়নি আজিও প্রতিবাদ করিবার? ,
1452,আজ দাদার ভয়ে চুপচাপ হয়ে থাকতেই হয় যদি তবে কেন আজো আগলে রেখেছো স্বাধীন দেশের গদি? ,
1453, মানুষ করোনি মোরে রেখেছো বাঙালি করে আজ এটা প্রমানিত অস্থায়ী ভাবে ও তো আশ্রয় দেয়া যেত তাদের ,
1455, হে আল্লাহ্ আপনি এদের একমাত্র সম্ভল এবং সায্য কারী। ,
1456, কপালের লিখন খন্ডাবে কে এখন ? ,
1457, বাংলাদেশ সরকার নিরীহ মুসলিমদের সাহায্য করছেনা কেন? ,
1458, মানবতা মৃতপ্রায় নাফ নদীতে ভাসলে কি আসে যায়? ,
1459, এই পৃথিবী টা কাদের যে ওদের বসবাসের জায়গা নেই ,
1460, মানুষ করোনি মোরে রেখেছো বাঙালি করে আজ এটা প্রমানিত ,
1461, হে আললাহ তুমি মজলুম দের হেফাযত কর ,
1462, পড়লে আপনার উপকার হবেই এখন নয় পড়ে ,
1464, যেখানেই ট্রাম্পের আলোচনা সেখানেই নারী ,
1465, এই বালের নিউজ না দিয়ে মায়ানমার এর দিকে তাকান সেখানকার অসহায় নারী শিশু নিয়ে প্রতিবেদন দেন ,
1468, জীবনের গল্প পড়তে লাইক করুন এই পেজে জীবনের গল্প ,
1470, ভাই তোমার সাথে ক্রিকেট খেলা আর দেখা করার কোন স্বপ্ন আমার আদৌ নেই কারণ তুমি একটা অহংকারী আর বেয়াদব ,
1471, নিজের চরকায় তেল দেন।সািকব কে নিয়ে অাপনােক না ভাবলেও চলেবে ,
1472, বিয়াদ্দব তুই সাকিব ভাইয়া নই ,
1476, বেয়াদব ক্রিকেটার অফ দ্যা সেঞ্চুরী ,
1477, আমি কইলে তো কইবেন হাজী সাবের মুখ খরাপ জ্ঞানী লোকের জ্ঞান আর কুত্তায় চিনে ভাতের ফেন সে সাকিব হোক তার তার জন্মদেয়া বাপ হোক ,
1479, বিশ্বসেরা অলরাউন্ডারের বিশ্ব বেহায়া কর্মকান্ডের তীব্র নিন্দা জানাচ্ছি ,
1481, যে বা যারা সাকিব ভাই কে খারাপ বলে ,
1482, ওর সাথে কি সেল্ফি তুলবো ও তো আস্তে একটা বেয়াদপ কেও তার সাথে সেল্ফি তুলতে গেলে তার মুবাইল পানিতে ফেলে দেয় ,
1484, সালায় নিজের যোগ্যতার থেকে অনেক বেশী পাইছে তাই মানুষ কে মানুষ মনে করেনা সালা ফকিরনি একটা ,
1486, টাকা দামের মোবাইল ইতারে দিয়া ভাঙ্গাইতাম? নাহ দরকার হইলে ছোট ভাইরে দিয়া ভাঙামু মাফ করেন ,
1489, বাপরে বাপ কার সাথে সেলফি তুলবে সাকিবের সাথে? আপনারা যদি মোবাইল হারাতে চান তাহলে যান সাকিবের সাথে সেলফি তুলতে। ,
1490, সেলফি তুলতে চাইলে কেউ তার মোবাইল পানিতে ফেলাস।আবার বলে সেলফি তুলতে।এমন অহংকারী লোকের সাথে সেলফি তুলে কি জান্নাতে যাবে নাকি ,
1491, আমার ফন টা কি হারাব।।।।।।বিয়াদব।।।একটা ,
1492, ওর সাথে সেলফি কায়দায় অার কাজ নাই।তার চাইতে কুকুর অনেক ভাল ,
1493, এই বেয়াদব ফাজিলের সাথে ক্রিকেট খেলার কোন ইচ্ছা আমার নাই ,
1494, জুতা জারা সিলাই করে বাল টাকা রুজি করে তুই তো ওদের মত ,
1495, মোবাইলটা খোয়ানোর ইচ্ছা আমার নেই ,
1496, তোর সাথে সেলফি না তুলে থাক কিছু লিখলাম না ,
1497, মোবাইল পানিতে ফালাইব না তো ,
1498, ভাইয়া শীতকালেও কি আইসক্রিম খাব নাকি ? ,
1499, সেলফি তুলতে গিয়ে যদি আমার মোবাইলটা ফেলে দেই ,
1500, বিশ্ব বেয়াদপের সাথে সেলফি না তুলা বালো। ,
1501, বিশ্ব সেরা বেয়াদপ এর সাথে।। ,
1502, এই আইচক্রিম খাইলে মানুষ সব বেয়াদব হয়ে যায় জলদি কিনুন স্টক সিমিত ,
1503, সাকিব আল হাসান কি জাএনজি আইসক্রিম খায়? ,
1504, মামুনি তোমার আবু্ব একটা আন্তজার্তিক বিয়াদপ ,
1505, ভাই সাকিব আল হাসান কে ভুল বুঝবেন না ,
1506, অহংকারিকে আল্লাহতায়ালা পচন্দ করে না ,
1507, যদি মোবাইল টা ফেলে দেয় তখন কি করবো?????? ,
1508, কম পানির মাছ বেশী পানিতে পড়লে যেটা হয় ,
1510, আজকে একদিন খেয়েই ঠান্ডা লেগে গেছে আবার খাবো?? ,
1511, যত সব আজে বাজে নিউজ ,
1513, ভাই অন্যদেরকে নিয়ে লাফালফি না করে আগে নিজের চিন্তা করো ,
1514, বাংলাদেশের একজন পাগল ক্রিকেটারের নাম বলতে পারবেন ,
1518,যারা সাকিব কে বেয়াদব বলেন তাদের জন্য রুশাদ ভাই এর লেখাটা হুবহু তুলে দিলাম ,
1520, সাকিব এর সাথে সেলফি তোলার চাইতে বনের পশুর সাথে সেলফি তোলা ভালো হবে কারন তার বেবহার ভালোনা ,
1521, জনগনের টাকায় বেতন নিচ্ছে আবার অহংকার দেখায় ,
1522, যে ভক্তদের ভালবাসার মুল্যায়ন করে না সেতো ,
1523, সাকিব হলো বাংলাদেশ দলের সবচেয়ে বে ,
1524, সাকিবের ব্যবহার এর কারনে তার সকল মডেলের ব্রান্ড আমরা সবাই কি পরিহার করতে পারি না ? আসুন বর্জন করি । ,
1526, তুমি যে পন্যের এড করবে আমরা সেই পন্য বর্জন করবো তোমার সাথে কোঃপানির গুয়াই বাঁশ কুততা সালা ? ,
1528, শীতে আবার বাল জি খাইতে কয় ,
1529,তারপর নাকি ওর সাথে খেলার সুযোগ ,
1530,বেয়াদব এর সাথে খেলার কোন আগ্রহ ,
1531, আমার সাকিবের ছবি ছিল ওর অহংকার আর বেয়াদবির কারনে সেটা কেটে দিয়েছি ,
1533, তোমাদের মধ্যে ঐ ব্যক্তি সর্বোত্তম ,
1534,যে নিজে কোরআন শিখে এবং অন্যকে ,
1536, বিশ্বসেরা অলরাউন্ডারকে নিয়ে মিথ্যা প্রচারে ফেসবুকে ভাইরাল ,
1544,কোনো এ টাকা লাগবে না ,
1545, পাখি যারা ধরে তাদের হাতের অাঙ্গুলগুলো থেথলিয়ে দিন। ,
1546, লাইক দিন এই পেজে বুড়ো দাদু আর উপভোগ করুন আনলিমিটেড মজা আনলিমিটেড অফার এর মতই প্রাণ খুলে মজা ,
1550, দানবীর রাগীব আলীকে আমি খুব ভালো করে চিনি। ,
1551,ওনার প্রধান অপরাধ হচ্ছে তিনি জামাত করেন। যার কারনে তিনি এত হয়রানির শিকার হচ্ছেন। ,
1553, ধনী হতে হলে নিতি থাকতে হয় এটা কথার কথা আসলে ধনী হতে হলে গরিব অসহায়দের টাকা মেরে খেতে হয় এটাই বাস্তবতা ,
1554, তিনিই সেই রাগীব আলী না যিনি পুলিশলীগের উপর চাঁদাবাজির অভিযোগ এনেছিলেন? ,
1556, ভাবখানা এমন যে মনে হয় রাগিবআলীর ফুয়া সিলেটের ঐতিহ্যবাহী একটি প্রবাদ ,
1557, কোটি টাকা খরচ করেই নিয়ে নিবে জামিন ,
1558, উনি শুধু ব্যবসায়ী নয় উনি লক্ষ বেকারে আর্তকর্মসহান কারি ,
1559, ভূমি দস্যু রাগিব সংখ্যালগুর জমি দখল করছে তার বিচার হউক। ,
1560, উনি দানবীর উনাকে অসম্মান করবেন না।প্লিজ প্লিজ প্লিজ ,
1561, পাপ তার বাপেরেও ছাড়ে না ,
1562, আমাদের চেটিয়া পাঁঠাটাকে বাংলাদেশ দিয়েছে আমরাও তোমাদের মাল তোমাদের দিয়ে দিলাম ,
1563, মন্তব্য করবো না যেহেতু এর দেশ। ,
1564, সালাউদ্দিন আহম্মেদ কেনো ফেরৎ পাঠাইনি? ,
1566, মোদির সরকার বলেইতো এটা সম্ভব জয় ভবানী ,
1567, র শনি বারের ফোন ইন এর বিষয় কি ?? ? ,
1568, অন্যায় কারি যত বড হোক আইনের আওতায় আসতে হবে ,
1571, তবে একজন শরনার্থীকেও বাংলাদেশে ফেরত পাঠানো যাবে না। এটাই শর্ত । ,
1575, যদি ওনার নাম রাগিব আলি নাহয়ে শ্রী নেপাল চন্দ্ররায় হতো তাহলে কি পেরত দিতো রেন্ডিয়া ,
1577, খুব ভালো আরো ভালো পোষ্ট চাই ,
1579, এভাবে আর কত প্রান হারাবে। ,
1586, এক নেত্রীর সব মামলা খারিজ আরেক জন মামলার হাজিরা দিতে দিতে শেষ এই তো আমাদের স্বাধীন বিচার বিভাগ ,
1587, ফখরুদ্দীন মইনুদ্দীন নাকি ছিল অবৈধ সরকার। ,
1588,কিন্তু তাদের মামলা গুলো ছিল বৈধ। ,
1589,একই মামলা করা হল খালেদা জিয়া শেখ হাসিনার বিরুদ্ধে। ,
1590,কিন্ত শেখ হাসিনাপ্রধানমন্ত্রী সে সব মামলা থেকে খালাস। ,
1591,কিন্তু খালেদার মামলা গুল ঝুলে আছে। ,
1592,তাহলে কি খালেদা প্রধানমন্ত্রী না হলে মামলা শেষ হবে না? ,
1593, হাসিনার মামলাগুলো ফিরিয়ে এনে একই আদালতে বিচার চলুক। ,
1594,দেখা দরকার আদালত কতটা সঠিক রায় দিতেপারে? ,
1596, আদালত হলো এখন কৌতুক আর তামাশার জায়গা বাহ্ বাহ্ আর কত কি দেখব স্বাধীন দেশে ,
1600, আমদের দেশের দূর্নীতি দমন কমিশটাই একটা মহা দূর্নীতির আখড়া আগে এদের বিচার হওয়া দরকার ,
1601, হাসিনা বঙবন্দুর মেয়ে খালেদার বাপের নাম কি? ,
1602, আল্লাহ রহমত দান করুণ ওদের প্রতি কেননা ওরা খুবই অসহায় ,
1603, কারণ খালেদা মুক্তিযোদ্ধার স্ত্রী । ,
1604, মিথ্যা সরকারকে প্রতিষ্ঠিত করতে তাই গণতন্ত্রকে হত্যা ,
1605, খালেদাজিয়ার প্রতি এ অন্যায় আচরনন ঠিক না। ,
1606, অথচ ইয়াবা বদির বছর সাজা হবার পর ও জামিনে।মুক্তি পাই ,
1609, উনি দলের চেয়ে নিজেকে বেশি ভালবাসেন। ,
1610, ক্ষমতায় থাকলে সাত খুন মাফ আর না থাকলে ? ,
1611, বিষয়টা কি আইন অনুসারে হচ্ছে না ইচ্ছা মত করা সম্ভব? তবে সুশাসন দরকার ,
1612, যোগ্য পিতার অযোগ্য সন্তান এই হাসিনা ,
1613, এ জীবন ছাড়খার করে তবেই শান্তি। ,
1615, এত সাজুগুজুু ভাল লাগে না ,
1616, অবৌধো হাসিনা খমতায় টিকে থাকার জন্যো আরো কতো কিছু করবে কিন্তু দিন জনোগন ঝারুদিয়া পিটাইয়া দেশ ছাড়া করবে ,
1617, আগামী নির্বাচনে খালেদা তারেক সহ বিএনপির বড়বড় নেতারা অংশগ্রহণ করতে পারবেনা। সাজা দিয়ে দেবে। সরকার সেই পথেই আগাচ্ছে। ,
1618, বাংলাদেশের জন্য বড় লজ্জা হল যখন কোন দলের প্রধান নেত্রী দুরনীতি করে আবার আদালতে কাছে যেয়ে আত্নোসমর্থন করে ,
1619, চলুক চলতেই থাকবে এর শেষ কোথায় সয়ং বিচারক মহোদয় জানেন না। ঝুলিয়ে না রেখে একটা ফয়সালা করে ফেললে দেশের অনেক ভালো হতো । ,
1621, আমি মনে করি এই মামলা চলা উচিৎ। দশের সমপদ যেই নষ্ট করবে সেই অপরাধী। ,
1622, ট্রাম্পের নাম শুনলেই কাংলুরা লুঙ্গিতে হিসু করে দেয় কেনো???মোদীর পর এখন আবার মিয়ানমারের নাম শুনলেও লুঙ্গি তুলে দৌড় মারে হা হা হা ,
1624, আমরা আবারো হিটলারকে স্মরণ করতে চাই।আর এটা তখনি সম্ভব যখন হিটলারের প্রেতাত্মা ট্রাম্প নারকীয় কাজ করবে ,
1625, হা হা ট্রাম্পের খবর পেলে রেন্ডিয়ান বালকাতার রিফুজি কাংলুরা ধুতি ড্যান্স মারে। ,
1627, তার মানে এটা সাজানো নাটিকা ছিল। ,
1629, গাইবান্ধার বীর মুক্তিযোদ্ধা আজাদ কে খুজে পাওয়া যাচ্ছেনা ,
1632, নবীর জীবনী পাঠ কেন গুরুত্বপূর্ণ ,
1633,মুহম্মদকে নবী মানি না সেটা কোনো ইগো বা ,
1634,জিদের বশে নয়। সাধারণ কিছু প্রশ্নের উত্তর না ,
1635,পাওয়ার জন্য। একজন মুসলিম কি গোলাম আহমদ ,
1636,কাদিয়ানীকে নবী মানবে? মানবে না। তার কাছে ,
1637,গোলাম আহমদ হল প্রতারক মিথ্যুক। মিথ্যা দাবিদার। ,
1638,ঠিক তেমনি আমি বিশ্বাস করি মুহম্মদ সত্যি সত্যি নবী ,
1639,ছিলেন না। প্রথমদিকে অসুস্থতাবশত তারপর ইগো ,
1640,বশত নিজেকে নবী দাবি জারি রাখেন। গোলাম ,
1642,মুহম্মদ কিশোর বয়সে একবার তার চাচার সাথে সিরিয়া ,
1643, ও আচ্ছা তাহলে এ ব্যাপার ,
1644,কাশেম স্যার আপনারা মার্কিনিরা সবাই নারীর ক্ষমতায়ন নিয়ে কথা বলে আসছেন কিন্তু ভোটের সময় ঠিক তার উল্টো হলো কেন? ,
1645,ট্রাম্প এই প্রশ্ন আমেরিকার ক্ষেত্রে প্রযোজ্য না এটা মুসলিম রাষ্ট্রের সময় প্রযোজ্য। আপনি অন্য প্রশ্ন করতে পারেন। ,
1646,কাশেম ট্রাম্পের বিজয়ে ইন্ডিয়ানরা খুব উল্লসিত তারা ধুতি খুলে নাচানাচি করছে তাদের ব্যাপারে ,
1648, কুফরী কিতাব ইসলামের অজানা অধ্যায় তৃতীয় খণ্ড ,
1653, বাংলার বৌদ্ধদের দোষ দেওয়া যাবেনা তবে বৌদ্ধদের উচিত বর্মিদের বিরুদ্ধে প্রতিবাদ করা এই অন্যায়ের বিরুদ্ধে। ,
1654, ভাই দয়া করে সাম্প্রদায়িক বক্তব্য দিবেন না। মায়ানমারের সরকার হত্যাজজ্ঞ করলে এ দেশের বৌদ্ধরা কেন ভুগবে? ,
1655, তাহলে বার্মা ও আমাদের মাঝে পার্থক্য কি থাকবে? ,
1656, কিন্তু এ দে শের বোদ্ধরা তো মায়ানমা রের বোদ্ধ দের গনহত্যার কোন প্র তিবাদ কর তে ছে না। ,
